{
  "captured_utc": "2026-08-29T11:36:19Z",
  "completion": {
    "g2_remains_blocked_by_other_open_criteria": true,
    "observed_ambiguous_targets": 15,
    "observed_unresolved_targets": 19,
    "required_ambiguous_targets": 0,
    "required_unresolved_targets": 0,
    "satisfied": false
  },
  "completion_criteria_satisfied": false,
  "criterion_id": "G2-06",
  "detail_export": {
    "bytes": 10776199,
    "lines": 3651,
    "path": "Data/Exports/P2-20/p2-20a-asset-descriptor-diagnostics.jsonl",
    "sha256": "5104bb44e27a1bb318720142bdae77a19205ab2d17b5a8c9e6263673503b6384",
    "tracked": false
  },
  "diagnostic_scope_complete": true,
  "disclosure": {
    "anonymous_identities_only": true,
    "decoded_confidential_payloads": false,
    "exact_primary_keys": false,
    "legacy_source_lines": false,
    "private_source_paths": false,
    "raw_table_rows": false
  },
  "evidence_revision": "P2-20A.4",
  "g2_06_satisfied": false,
  "input_bindings": [
    {
      "bytes": 5424,
      "lines": 162,
      "path": "Data/Inventory/p2-03-package-dependency-graph.json",
      "sha256": "29ebc990b178bad4a99f4b09cc34731bba7dd43d37a288e7bdbe1a1ef284b3ab",
      "tracked": true
    },
    {
      "bytes": 6306,
      "lines": 189,
      "path": "Data/Inventory/p2-12-full-asset-inventory.json",
      "sha256": "f3c2bac9fd0cf3415537011f7a2211e6cf6a603c1cde462cb93a3175fab2871a",
      "tracked": true
    },
    {
      "bytes": 7789,
      "lines": 264,
      "path": "Data/Inventory/p2-13-reference-closure.json",
      "sha256": "7bf5803b5fa22e1dad39a30fb6d2e953c476b9ce214e53f8140f1e977c6535ef",
      "tracked": true
    },
    {
      "bytes": 7819075,
      "lines": 21494,
      "path": "Data/Exports/P2-20/p2-20a-asset-binding-workset.jsonl",
      "sha256": "fb986a21eaa905737a05c4e0b451241135d2c7f61547aa98144e0cedd6e4537c",
      "tracked": false
    },
    {
      "bytes": 3477,
      "lines": 86,
      "path": "Contracts/data-schema/g2-asset-descriptor-diagnostics-policy-v1.json",
      "sha256": "461d65c4cc7e7f3ce61651362814c85c92ec4e29225ed8a2aecb5a5335a6974b",
      "tracked": true
    },
    {
      "bytes": 6873,
      "lines": 160,
      "path": "Contracts/data-schema/g2-asset-descriptor-diagnostics-v1.schema.json",
      "sha256": "3c85a607576a92209f422edd7e5f2a97e7c017b3d0b26f195ac82ce413158858",
      "tracked": true
    }
  ],
  "measured": {
    "ambiguous_targets": 15,
    "binding_pass_candidates": 12561,
    "binding_rejected_candidates": 203,
    "by_family": {
      "anim": {
        "ambiguous": 6,
        "candidate_edges": 222,
        "resolved": 102,
        "targets": 114,
        "unresolved": 6
      },
      "qtx": {
        "ambiguous": 1,
        "candidate_edges": 11051,
        "resolved": 2311,
        "targets": 2324,
        "unresolved": 12
      },
      "skem": {
        "ambiguous": 6,
        "candidate_edges": 1151,
        "resolved": 1037,
        "targets": 1043
      },
      "sm": {
        "ambiguous": 2,
        "candidate_edges": 340,
        "resolved": 167,
        "targets": 170,
        "unresolved": 1
      }
    },
    "by_prior_resolution_basis": {
      "DESCRIPTOR_VALIDATION_FAILED": {
        "candidate_edges": 24,
        "targets": 19,
        "unresolved": 19
      },
      "DIVERGENT_DESCRIPTOR_SET": {
        "ambiguous": 9,
        "candidate_edges": 534,
        "resolved": 174,
        "targets": 183
      },
      "EQUIVALENT_VALID_DESCRIPTOR_SET": {
        "ambiguous": 6,
        "candidate_edges": 11271,
        "resolved": 2508,
        "targets": 2514
      },
      "UNIQUE_VALID_DESCRIPTOR": {
        "candidate_edges": 935,
        "resolved": 935,
        "targets": 935
      }
    },
    "by_resolution_basis_edges": {
      "MULTIPLE_COMPATIBLE_SEMANTIC_CLASSES": 30,
      "NO_PRODUCTION_COMPATIBLE_CANDIDATE": 24,
      "SINGLE_COMPATIBLE_SEMANTIC_CLASS": 12710
    },
    "by_resolution_basis_targets": {
      "MULTIPLE_COMPATIBLE_SEMANTIC_CLASSES": 15,
      "NO_PRODUCTION_COMPATIBLE_CANDIDATE": 19,
      "SINGLE_COMPATIBLE_SEMANTIC_CLASS": 3617
    },
    "descriptor_parsed_candidates": 12764,
    "descriptor_rejected_candidates": 0,
    "reconciled_full_workset": {
      "ambiguous_edges": 30,
      "ambiguous_targets": 15,
      "candidate_edges": 39351,
      "resolved_edges": 39297,
      "resolved_targets": 21460,
      "targets": 21494,
      "unknown_edges": 0,
      "unknown_targets": 0,
      "unresolved_edges": 24,
      "unresolved_targets": 19
    },
    "resolved_targets": 3617,
    "unresolved_targets": 19
  },
  "p3_authorized": false,
  "result": "BLOCKED",
  "review_execution_result": "PASS",
  "schema_version": 1,
  "scope": {
    "candidate_edges": 12764,
    "candidate_identity_exact": true,
    "first_candidate_selection_used": false,
    "production_binder_used": true,
    "selection": "all coarse-equivalent, divergent, zero-valid, and unique SKEM production-binding obligations",
    "targets": 3651
  },
  "source_build": "qy-3.0.0.413",
  "task_id": "P2-20A",
  "task_status": "BLOCKED"
}
